<data xmlns:xsi="http://www.w3.org/2001/XMLSchema-instance" xsi:noNamespaceSchemaLocation="../schemas/items.xsd">
    <item id="can_soda" price="1">
        <name>empty soda can</name>
    </item>
    <item id="can_aluminum" price="1">
        <name>rusted aluminum can</name>
    </item>
    <item id="scrap_wires" price="1">
        <name>scrap wires</name>
    </item>
    <item id="bag_plastic" price="1">
        <name>dirty plastic bag</name>
    </item>
    <item id="ecig_cartridge" price="1">
        <name>empty e-cig cartridge</name>
    </item>
    <item id="bottle_pill" price="1">
        <name>empty pill bottle</name>
    </item>
    <item id="cup_paper" price="1">
        <name>dirty paper cup</name>
    </item>
    <item id="can_spray_paint" price="1">
        <name>empty spray-paint can</name>
    </item>
</data>