<data xmlns:xsi="http://www.w3.org/2001/XMLSchema-instance" xsi:noNamespaceSchemaLocation="../schemas/items.xsd">
    <item id="nitron_cola" price="10">
        <name>Nitron Cola</name>
        <component type="consumable">
            <consumePrompt>Drink</consumePrompt>
            <consumePhrase>drink</consumePhrase>
            <effect>food_basic</effect>
        </component>
    </item>
    <item id="nitron_diet" price="10">
        <name>Nitron Diet</name>
        <component type="consumable">
            <consumePrompt>Drink</consumePrompt>
            <consumePhrase>drink</consumePhrase>
            <effect>food_basic</effect>
        </component>
    </item>
</data>