<data xmlns:xsi="http://www.w3.org/2001/XMLSchema-instance" xsi:noNamespaceSchemaLocation="../schemas/items.xsd">
    <item id="baseball_bat" price="15">
        <name>baseball bat</name>
        <component type="weapon" class="club" restricted="true">
            <damage base="10" crit="5"/>
            <rate>2</rate>
        </component>
        <component type="effectable"/>
        <component type="equippable">
            <slotGroup>
                <slot>hand_main</slot>
                <slot>hand_off</slot>
                <exposedComponent>weapon</exposedComponent>
            </slotGroup>
        </component>
    </item>
    <item id="katana" price="60">
        <name>katana</name>
        <description>
            <line>A razor-sharp sword of fine craftsmanship.</line>
        </description>
        <component type="weapon" class="sword" restricted="true">
            <damage base="20" crit="10"/>
            <rate>2</rate>
        </component>
        <component type="effectable"/>
        <component type="equippable">
            <slotGroup>
                <slot>hand_main</slot>
                <slot>hand_off</slot>
                <exposedComponent>weapon</exposedComponent>
            </slotGroup>
        </component>
    </item>
    <item id="pistol_light" price="30">
        <name>light pistol</name>
        <component type="weapon" class="pistol" restricted="true">
            <damage base="10" crit="5"/>
            <rate>2</rate>
        </component>
        <component type="magazine" restricted="true">
            <ammoType>ammo_pistol</ammoType>
            <size>12</size>
            <reloadActionPoints>1</reloadActionPoints>
        </component>
        <component type="effectable"/>
        <component type="moddable">
            <modSlot name="pistol_mag"/>
        </component>
        <component type="equippable">
            <slotGroup>
                <slot>hand_main</slot>
                <exposedComponent>weapon</exposedComponent>
                <exposedComponent>magazine</exposedComponent>
            </slotGroup>
            <slotGroup>
                <slot>hand_off</slot>
                <exposedComponent>weapon</exposedComponent>
                <exposedComponent>magazine</exposedComponent>
            </slotGroup>
        </component>
    </item>
    <item id="pistol_heavy" price="50">
        <name>heavy pistol</name>
        <component type="weapon" class="pistol" restricted="true">
            <damage base="14" crit="6"/>
            <rate>2</rate>
        </component>
        <component type="magazine" restricted="true">
            <ammoType>ammo_pistol</ammoType>
            <size>6</size>
            <reloadActionPoints>1</reloadActionPoints>
        </component>
        <component type="effectable"/>
        <component type="moddable">
            <modSlot name="pistol_mag"/>
        </component>
        <component type="equippable">
            <slotGroup>
                <slot>hand_main</slot>
                <exposedComponent>weapon</exposedComponent>
                <exposedComponent>magazine</exposedComponent>
            </slotGroup>
            <slotGroup>
                <slot>hand_off</slot>
                <exposedComponent>weapon</exposedComponent>
                <exposedComponent>magazine</exposedComponent>
            </slotGroup>
        </component>
    </item>
    <item id="rifle_auto" price="90">
        <name>auto rifle</name>
        <description>
            <line>A full-auto assault rifle.</line>
        </description>
        <component type="weapon" class="assault_rifle" restricted="true">
            <damage base="15" crit="4"/>
            <rate>2</rate>
        </component>
        <component type="magazine" restricted="true">
            <ammoType>ammo_rifle</ammoType>
            <size>16</size>
            <reloadActionPoints>1</reloadActionPoints>
        </component>
        <component type="effectable"/>
        <component type="equippable">
            <slotGroup>
                <slot>hand_main</slot>
                <slot>hand_off</slot>
                <exposedComponent>weapon</exposedComponent>
                <exposedComponent>magazine</exposedComponent>
            </slotGroup>
        </component>
    </item>
    <item id="grenade_frag" price="10">
        <name>frag grenade</name>
        <component type="weapon" class="grenade" restricted="true">
            <damage base="20" crit="5"/>
            <rate>1</rate>
        </component>
        <component type="effectable"/>
        <component type="equippable">
            <slotGroup>
                <slot>hand_main</slot>
                <exposedComponent>weapon</exposedComponent>
            </slotGroup>
            <slotGroup>
                <slot>hand_off</slot>
                <exposedComponent>weapon</exposedComponent>
            </slotGroup>
        </component>
    </item>
</data>