<data xmlns:xsi="http://www.w3.org/2001/XMLSchema-instance" xsi:noNamespaceSchemaLocation="../schemas/items.xsd">
    <item id="stratis_room_key">
        <name>Stratis room 508 keycard</name>
    </item>
    <item id="stratis_master_key">
        <name>Stratis master keycard</name>
    </item>
    <item id="nexus_bouncer_key">
        <name>Nexus bouncer key</name>
    </item>
    <item id="stratis_security_key">
        <name>Stratis security key</name>
    </item>
    <item id="wilsons_corner_store_key">
        <name>Wilson's corner store key</name>
    </item>
</data>