<data xmlns:xsi="http://www.w3.org/2001/XMLSchema-instance" xsi:noNamespaceSchemaLocation="../schemas/items.xsd">
    <item id="tactical_vest" price="40">
        <name>tactical vest</name>
        <component type="equippable">
            <slotGroup>
                <slot>torso</slot>
            </slotGroup>
        </component>
        <component type="armor" coversMainBody="true">
            <damage type="physical" resistance="5"/>
        </component>
    </item>
    <item id="tactical_helmet" price="30">
        <name>tactical helmet</name>
        <component type="equippable">
            <slotGroup>
                <slot>head</slot>
            </slotGroup>
        </component>
        <component type="armor">
            <coveredLimb>head</coveredLimb>
            <damage type="physical" resistance="3"/>
        </component>
    </item>
</data>