<data xmlns:xsi="http://www.w3.org/2001/XMLSchema-instance" xsi:noNamespaceSchemaLocation="../schemas/items.xsd">
    <item id="burger" price="10">
        <name>hamburger</name>
        <component type="consumable">
            <consumePrompt>Eat</consumePrompt>
            <consumePhrase>eat</consumePhrase>
            <effect>food_basic</effect>
        </component>
    </item>
    <item id="burger_cheese" price="10">
        <name>cheeseburger</name>
        <component type="consumable">
            <consumePrompt>Eat</consumePrompt>
            <consumePhrase>eat</consumePhrase>
            <effect>food_basic</effect>
        </component>
    </item>
    <item id="burger_deluxe" price="10">
        <name>deluxe hamburger</name>
        <component type="consumable">
            <consumePrompt>Eat</consumePrompt>
            <consumePhrase>eat</consumePhrase>
            <effect>food_basic</effect>
        </component>
    </item>
    <item id="french_fries" price="10">
        <name>french fries</name>
        <component type="consumable">
            <consumePrompt>Eat</consumePrompt>
            <consumePhrase>eat</consumePhrase>
            <effect>food_basic</effect>
        </component>
    </item>
    <item id="nutri_chips_bacon" price="5">
        <name>Smoky Bacon Nutri-Chips</name>
        <component type="consumable">
            <consumePrompt>Eat</consumePrompt>
            <consumePhrase>eat</consumePhrase>
            <effect>food_basic</effect>
        </component>
    </item>
    <item id="nutri_chips_wasabi" price="5">
        <name>Wasabi Ginger Nutri-Chips</name>
        <component type="consumable">
            <consumePrompt>Eat</consumePrompt>
            <consumePhrase>eat</consumePhrase>
            <effect>food_basic</effect>
        </component>
    </item>
    <item id="gumball" price="1">
        <name>gumball</name>
        <component type="consumable">
            <consumePrompt>Eat</consumePrompt>
            <consumePhrase>eat</consumePhrase>
            <effect>food_basic</effect>
        </component>
    </item>
</data>